{
  "$schema": "http://json-schema.org/draft-07/schema#",
  "$id": "https://maltashop.example/contracts/order-placed.v1.schema.json",
  "title": "OrderPlaced v1",
  "description": "Published by order-service on exchange 'maltashop.events' with routing key 'order.placed' once an order is CONFIRMED (stock reserved and payment approved). Contains no personal data beyond an opaque customer_id (GDPR data minimisation).",
  "type": "object",
  "additionalProperties": false,
  "required": ["event_id", "event_type", "event_version", "occurred_at", "correlation_id", "data"],
  "properties": {
    "event_id": { "type": "string", "format": "uuid" },
    "event_type": { "const": "OrderPlaced" },
    "event_version": { "const": 1 },
    "occurred_at": { "type": "string", "format": "date-time" },
    "correlation_id": { "type": "string", "minLength": 1 },
    "data": {
      "type": "object",
      "additionalProperties": false,
      "required": ["order_id", "customer_id", "total_cents", "currency", "items"],
      "properties": {
        "order_id": { "type": "string", "format": "uuid" },
        "customer_id": { "type": "string", "minLength": 1 },
        "total_cents": { "type": "integer", "minimum": 0 },
        "currency": { "const": "EUR" },
        "payment_ref": { "type": "string" },
        "items": {
          "type": "array",
          "minItems": 1,
          "items": {
            "type": "object",
            "additionalProperties": false,
            "required": ["sku", "qty", "unit_price_cents"],
            "properties": {
              "sku": { "type": "string", "minLength": 1 },
              "qty": { "type": "integer", "minimum": 1 },
              "unit_price_cents": { "type": "integer", "minimum": 0 }
            }
          }
        }
      }
    }
  }
}
